{
  "$schema": "../schemas/repository-policy.schema.json",
  "deniedRoots": [
    "UserContent/",
    "Assets/Original/",
    "analysis/original/",
    "reference/original/"
  ],
  "restrictedExtensions": [
    ".666", ".avi", ".bmp", ".csf", ".cue", ".dat", ".dib", ".exe",
    ".flc", ".fli", ".fnt", ".gob", ".gif", ".ico", ".iso", ".jpeg",
    ".jpg", ".low", ".mdf", ".mds", ".mid", ".midi", ".mp3", ".nrg",
    ".ogg", ".pal", ".pcc", ".pcx", ".png", ".rat", ".res", ".smk",
    ".wav"
  ],
  "approvedRestrictedRoots": [
    "assets/clean-room/",
    "tests/fixtures/synthetic/"
  ],
  "maximumTrackedFileBytes": 1048576,
  "approvedLargeFiles": []
}
